{"metadata_schema_version":"1.0","external_metadata_schema_version":"1.0","producer":{"producer_id":"hypothetical-independent-producer","producer_version":"1.0.0"},"authority":"CONTRACT_AUTHORITATIVE","relations":[{"relation_id":"toolchain-class-fk","comparison":"EXACT_VALUE","provenance":"MCP_VFP9SP2_TOOLCHAIN","assurance":"VERIFIED","authority":"CONTRACT_AUTHORITATIVE","members":[{"table":"customers/data.dbf","field":"CUST_ID","role":"PRIMARY","ordinal":1,"dbf_type":"C","byte_width":10,"encoding":"cp1250","nullable":false},{"table":"orders/data.dbf","field":"ORDER_CUST","role":"FOREIGN","ordinal":1,"dbf_type":"C","byte_width":10,"encoding":"cp1250","nullable":false}]},{"relation_id":"external-class-fk","comparison":"EXACT_VALUE","provenance":"EXTERNAL_VFP_METADATA","assurance":"VERIFIED","authority":"CONTRACT_AUTHORITATIVE","members":[{"table":"orders/data.dbf","field":"ORDER_ID","role":"PRIMARY","ordinal":1,"dbf_type":"C","byte_width":10,"encoding":"cp1250","nullable":false},{"table":"lines/data.dbf","field":"ORDER_REF","role":"FOREIGN","ordinal":1,"dbf_type":"C","byte_width":10,"encoding":"cp1250","nullable":false}]}]}