{"metadata_schema_version":"1.0","external_metadata_schema_version":"1.0","producer":{"producer_id":"p","producer_version":"1"},"authority":"CONTRACT_AUTHORITATIVE","relations":[{"relation_id":"policy-file-planning","comparison":"EXACT_VALUE","provenance":"POLICY_FILE","assurance":"UNVERIFIED","authority":"CONTRACT_AUTHORITATIVE","members":[{"table":"customers/data.dbf","field":"CUST_ID","role":"PRIMARY","ordinal":1,"dbf_type":"C","byte_width":10,"encoding":"cp1250","nullable":false},{"table":"orders/data.dbf","field":"ORDER_CUST","role":"FOREIGN","ordinal":1,"dbf_type":"C","byte_width":10,"encoding":"cp1250","nullable":false}]}]}