{
  "metadata_schema_version": "1.0",
  "external_metadata_schema_version": "1.0",
  "producer": {"producer_id": "hypothetical-independent-producer", "producer_version": "1.0.0"},
  "authority": "INFERRED",
  "relations": [
    {"relation_id": "suggested-join", "comparison": "EXACT_VALUE", "provenance": "EXTERNAL_VFP_METADATA", "assurance": "UNVERIFIED", "authority": "INFERRED", "members": [
      {"table": "customers/data.dbf", "field": "CUST_ID", "role": "PRIMARY", "ordinal": 1, "dbf_type": "C", "byte_width": 10, "encoding": "cp1250", "nullable": false},
      {"table": "orders/data.dbf", "field": "ORDER_CUST", "role": "FOREIGN", "ordinal": 1, "dbf_type": "C", "byte_width": 10, "encoding": "cp1250", "nullable": false}
    ]}
  ]
}
